{
  "type": "LineaTokenList",
  "tokenListId": "https://raw.githubusercontent.com/Consensys/linea-token-list/main/json/linea-sepolia-token-shortlist.json",
  "name": "Linea Sepolia Token List",
  "createdAt": "2024-03-29",
  "updatedAt": "2024-04-26",
  "versions": [
    {
      "major": 1,
      "minor": 2,
      "patch": 0
    }
  ],
  "tokens": [
    {
      "chainId": 59141,
      "chainURI": "https://sepolia.lineascan.build/block/0",
      "tokenId": "https://sepolia.lineascan.build/address/0xf17a935A89cB4CBc176cd5afeBCB9805e5Ed7c1A",
      "tokenType": ["bridge-reserved", "external-bridge"],
      "address": "0xf17a935A89cB4CBc176cd5afeBCB9805e5Ed7c1A",
      "name": "USDC",
      "symbol": "USDC",
      "decimals": 6,
      "createdAt": "2024-03-27",
      "updatedAt": "2024-03-27",
      "logoURI": "https://s2.coinmarketcap.com/static/img/coins/64x64/3408.png",
      "extension": {
        "rootChainId": 11155111,
        "rootChainURI": "https://sepolia.etherscan.io/block/0",
        "rootAddress": "0x1c7D4B196Cb0C7B01d743Fbc6116a902379C7238"
      }
    },
    {
      "chainId": 59141,
      "chainURI": "https://sepolia.lineascan.build/block/0",
      "tokenId": "https://sepolia.lineascan.build/address/0x06565ed324Ee9fb4DB0FF80B7eDbE4Cb007555a3",
      "tokenType": ["native"],
      "address": "0x06565ed324Ee9fb4DB0FF80B7eDbE4Cb007555a3",
      "name": "Wrapped Ether",
      "symbol": "WETH",
      "decimals": 18,
      "createdAt": "2024-03-29",
      "updatedAt": "2024-03-29",
      "logoURI": "https://s2.coinmarketcap.com/static/img/coins/64x64/2396.png"
    },
    {
      "chainId": 59141,
      "chainURI": "https://sepolia.lineascan.build/block/0",
      "tokenId": "https://sepolia.lineascan.build/address/0xFcAE759E3f149721f674Ea720361a76bBe67Ea8c",
      "tokenType": ["native"],
      "address": "0xFcAE759E3f149721f674Ea720361a76bBe67Ea8c",
      "name": "Dunachain",
      "symbol": "DUNA",
      "decimals": 18,
      "createdAt": "2024-09-26",
      "updatedAt": "2024-09-27",
      "logoURI": "https://i.ibb.co/VCpK4bR/1.png" 
    }
  ]
}
