{
  "type": "CanonicalTokenList",
  "tokenListId": "https://ipfs.io/ipns/k51qzi5uqu5dkkciu33khkzbcmxtyhn376i1e83tya8kuy7z9euedzyr5nhoew",
  "name": "Aggregate Canonical Token List",
  "createdAt": "2022-05-08",
  "updatedAt": "2022-05-09",
  "versions": [
    {
      "major": 1,
      "minor": 1,
      "patch": 1
    }
  ],
  "tokens": [
    {
      "chainId": 137,
      "chainURI": "https://polygonscan.com/block/0",
      "tokenId": "https://polygonscan.com/address/0x0000000000000000000000000000000000001010",
      "tokenType": ["fungible", "transferable"],
      "address": "0x0000000000000000000000000000000000001010",
      "name": "Matic",
      "symbol": "MATIC",
      "decimals": 18,
      "createdAt": "2020-05-31",
      "updatedAt": "2020-05-31",
      "logoURI": "https://polygonscan.com/token/images/matic_32.png",
      "extensions": [
        {
          "rootChainId": 137,
          "rootChainURI": "https://polygonscan.com/block/0",
          "rootAddress": "0x0000000000000000000000000000000000001010"
        }
      ]
    },
    {
      "chainId": 59140,
      "chainURI": "https://goerli.lineascan.build/block/0",
      "tokenId": "https://goerli.lineascan.build/token/0x7823e8dcc8bfc23ea3ac899eb86921f90e80f499",
      "tokenType": [
        "bridged"
      ],
      "address": "0x7823e8dcc8bfc23ea3ac899eb86921f90e80f499",
      "name": "Uniswap",
      "symbol": "UNI",
      "decimals": 18,
      "createdAt": "2023-06-23",
      "updatedAt": "2023-06-23",
      "logoURI": "https://s2.coinmarketcap.com/static/img/coins/64x64/7083.png",
      "extension": {
        "rootChainId": 5,
        "rootChainURI": "https://goerli.etherscan.io/block/0",
        "rootAddress": "0x41E5E6045f91B61AACC99edca0967D518fB44CFB"
      }
    }
  ]
}
