{
  "type": "LineaTokenList",
  "tokenListId": "TBD",
  "name": "Linea Goerli Token List",
  "createdAt": "2023-06-23",
  "updatedAt": "2023-06-23",
  "versions": [
    {
      "major": 1,
      "minor": 1,
      "patch": 1
    }
  ],
  "tokens": [
    {
      "chainId": 59140,
      "chainURI": "https://goerli.lineascan.build/block/0",
      "tokenId": "https://goerli.lineascan.build/token/0x7823e8dcc8bfc23ea3ac899eb86921f90e80f499",
      "tokenType": ["bridged"],
      "address": "0x7823e8dcc8bfc23ea3ac899eb86921f90e80f499",
      "name": "Uniswap",
      "symbol": "UNI",
      "decimals": 18,
      "createdAt": "2023-06-26",
      "updatedAt": "2023-06-26",
      "logoURI": "https://s2.coinmarketcap.com/static/img/coins/64x64/7083.png",
      "extension": {
        "rootChainId": 5,
        "rootChainURI": "https://goerli.etherscan.io/block/0",
        "rootAddress": "0x41E5E6045f91B61AACC99edca0967D518fB44CFB"
      }
    },
    {
      "chainId": 59140,
      "chainURI": "https://goerli.lineascan.build/block/0",
      "tokenId": "https://goerli.lineascan.build/token/0x2C1b868d6596a18e32E61B901E4060C872647b6C",
      "tokenType": ["native"],
      "address": "0x2C1b868d6596a18e32E61B901E4060C872647b6C",
      "name": "Wrapped Ethereum",
      "symbol": "WETH",
      "decimals": 18,
      "createdAt": "2023-06-26",
      "updatedAt": "2023-06-26",
      "logoURI": "https://s2.coinmarketcap.com/static/img/coins/64x64/2396.png"
    }
  ]
}
