{
  "type": "LineaTokenList",
  "tokenListId": "https://raw.githubusercontent.com/Consensys/linea-token-list/main/json/linea-sepolia-token-shortlist.json",
  "name": "Linea Sepolia Token List",
  "createdAt": "2024-03-29",
  "updatedAt": "2024-03-29",
  "versions": [
    {
      "major": 1,
      "minor": 0,
      "patch": 0
    }
  ],
  "tokens": []
}
